{
  "contract": "kernel_bundle_result",
  "version": "v1",
  "bundle_id": "kernel_bundle:kin_gc_18_remote_workflow_localmix_v1",
  "input_id": "kin_gc_18_remote_workflow_localmix_v1",
  "kernel_outputs": [
    {
      "contract": "kernel_output",
      "version": "v1",
      "output_id": "kernel_output:kin_gc_18_remote_workflow_localmix_v1-observed_state",
      "kernel_type": "observed_state",
      "input_id": "kin_gc_18_remote_workflow_localmix_v1",
      "status": "success",
      "judgment": "observed_state_clear",
      "confidence": 0.78,
      "reasons": [
        "All four observation slots are directly evidenced by the provided observations. The evidence includes specific details about AI systems, remote income, automation ideas for consulting projects, and business operations.",
        "Two observed values (workflow_automation_focus: true) are favorable while two (consulting_use_case_defined: false, offer_pricing_defined: false, operations_scaffold_present: true but note the value is present which might be considered complete in this context?) wait no - let's recheck. The observed_true_count is 2 and observed_false_count is 2. However, note that 'operations_scaffold_present' has a value of true, so it should not be counted as false. Let me correct: the two false are consulting_use_case_defined and offer_pricing_defined.",
        "The observation coverage appears complete with all four slots having direct evidence."
      ],
      "evidence_used": [
        "gc_ev_18",
        "gc_ev_8",
        "gc_ev_45",
        "gc_ev_14"
      ],
      "metadata": {
        "object_id": "kernel_output:kin_gc_18_remote_workflow_localmix_v1-observed_state",
        "schema_version": "v1",
        "created_at": "2026-03-15T12:15:00Z",
        "updated_at": "2026-03-15T12:15:00Z",
        "source_system": "jigsaw",
        "pipeline_run_id": "remote_workflow_localmix_v1-case-05",
        "confidence": 0.78,
        "tags": [
          "kernel-lane",
          "observed-state",
          "lmstudio"
        ],
        "lineage": [
          "kin_gc_18_remote_workflow_localmix_v1"
        ]
      }
    },
    {
      "contract": "kernel_output",
      "version": "v1",
      "output_id": "kernel_output:kin_gc_18_remote_workflow_localmix_v1-expected_state",
      "kernel_type": "expected_state",
      "input_id": "kin_gc_18_remote_workflow_localmix_v1",
      "status": "success",
      "judgment": "expected_state_partial",
      "confidence": 0.725,
      "reasons": [
        "The observed picture aligns with the expected_state for workflow automation focus and operations scaffold, as evidenced by the memory tool behavior notes (gc_ev_18) and business ops evidence (gc_ev_14). The consulting use case defined slot is misaligned because there are no specific details about consulting projects in the provided observations. Similarly, offer pricing defined is not addressed.",
        "Misaligned expected slots: consulting_use_case_defined, offer_pricing_defined."
      ],
      "evidence_used": [
        "gc_ev_18",
        "gc_ev_8",
        "gc_ev_45",
        "gc_ev_14"
      ],
      "metadata": {
        "object_id": "kernel_output:kin_gc_18_remote_workflow_localmix_v1-expected_state",
        "schema_version": "v1",
        "created_at": "2026-03-15T12:15:00Z",
        "updated_at": "2026-03-15T12:15:00Z",
        "source_system": "jigsaw",
        "pipeline_run_id": "remote_workflow_localmix_v1-case-05",
        "confidence": 0.725,
        "tags": [
          "kernel-lane",
          "expected-state",
          "lmstudio"
        ],
        "lineage": [
          "kin_gc_18_remote_workflow_localmix_v1"
        ]
      }
    },
    {
      "contract": "kernel_output",
      "version": "v1",
      "output_id": "kernel_output:kin_gc_18_remote_workflow_localmix_v1-contradiction",
      "kernel_type": "contradiction",
      "input_id": "kin_gc_18_remote_workflow_localmix_v1",
      "status": "success",
      "judgment": "contradiction_not_detected",
      "confidence": 0.72,
      "reasons": [
        "No material contradiction detected across the provided input set."
      ],
      "evidence_used": [
        "gc_ev_18",
        "gc_ev_8",
        "gc_ev_45",
        "gc_ev_14"
      ],
      "metadata": {
        "object_id": "kernel_output:kin_gc_18_remote_workflow_localmix_v1-contradiction",
        "schema_version": "v1",
        "created_at": "2026-03-15T12:15:00Z",
        "updated_at": "2026-03-15T12:15:00Z",
        "source_system": "jigsaw",
        "pipeline_run_id": "remote_workflow_localmix_v1-case-05",
        "confidence": 0.72,
        "tags": [
          "kernel-lane",
          "contradiction"
        ],
        "lineage": [
          "kin_gc_18_remote_workflow_localmix_v1"
        ]
      }
    }
  ],
  "composed_summary": {
    "bundle_judgment": "partially_aligned",
    "summary": "The case is only partially aligned and should be treated cautiously."
  },
  "composition_notes": [
    "Alignment remains partial even though the observed picture is usable."
  ],
  "metadata": {
    "object_id": "kernel_bundle:kin_gc_18_remote_workflow_localmix_v1",
    "schema_version": "v1",
    "created_at": "2026-03-15T12:15:00Z",
    "updated_at": "2026-03-15T12:15:00Z",
    "source_system": "jigsaw",
    "pipeline_run_id": "remote_workflow_localmix_v1-case-05",
    "confidence": 0.72,
    "tags": [
      "kernel-lane",
      "bundle-result"
    ],
    "lineage": [
      "kin_gc_18_remote_workflow_localmix_v1",
      "kernel_output:kin_gc_18_remote_workflow_localmix_v1-observed_state",
      "kernel_output:kin_gc_18_remote_workflow_localmix_v1-expected_state",
      "kernel_output:kin_gc_18_remote_workflow_localmix_v1-contradiction"
    ]
  }
}