{
  "contract": "kernel_bundle_result",
  "version": "v1",
  "bundle_id": "kernel_bundle:kin_gc_8_remote_workflow_localmix_calibrated_v1",
  "input_id": "kin_gc_8_remote_workflow_localmix_calibrated_v1",
  "kernel_outputs": [
    {
      "contract": "kernel_output",
      "version": "v1",
      "output_id": "kernel_output:kin_gc_8_remote_workflow_localmix_calibrated_v1-observed_state",
      "kernel_type": "observed_state",
      "input_id": "kin_gc_8_remote_workflow_localmix_calibrated_v1",
      "status": "success",
      "judgment": "observed_state_partial",
      "confidence": 0.6,
      "reasons": [
        "The observed_count (4) meets or exceeds the minimum_expected_observations (4), but one of the four observations is false for 'offer_pricing_defined'. The evidence shows that three items are true, and one is false, so it's not clear if all expected observations are present. However, since there are supporting observations, we can still consider this as partial coverage.",
        "The observed_items include a mix of true and false values. Specifically, 'offer_pricing_defined' has a value of false, while the other three have true. This indicates that some aspects might be missing or uncertain, leading to a partial judgment."
      ],
      "evidence_used": [
        "gc_ev_8",
        "gc_ev_22",
        "gc_ev_45",
        "gc_ev_14"
      ],
      "metadata": {
        "object_id": "kernel_output:kin_gc_8_remote_workflow_localmix_calibrated_v1-observed_state",
        "schema_version": "v1",
        "created_at": "2026-03-15T12:15:00Z",
        "updated_at": "2026-03-15T12:15:00Z",
        "source_system": "jigsaw",
        "pipeline_run_id": "remote_workflow_localmix_calibrated_v1-case-01",
        "confidence": 0.6,
        "tags": [
          "kernel-lane",
          "observed-state",
          "lmstudio"
        ],
        "lineage": [
          "kin_gc_8_remote_workflow_localmix_calibrated_v1"
        ]
      }
    },
    {
      "contract": "kernel_output",
      "version": "v1",
      "output_id": "kernel_output:kin_gc_8_remote_workflow_localmix_calibrated_v1-expected_state",
      "kernel_type": "expected_state",
      "input_id": "kin_gc_8_remote_workflow_localmix_calibrated_v1",
      "status": "success",
      "judgment": "expected_state_partial",
      "confidence": 0.6,
      "reasons": [
        "The expected value for 'workflow_automation_focus' (true) is aligned with the observed value (true). The evidence from gc_ev_8 supports this alignment.",
        "The expected value for 'consulting_use_case_defined' (true) is aligned with the observed value (true). The evidence from gc_ev_45 and gc_ev_14 provides support for consulting use cases in business operations.",
        "However, there is a misalignment on 'offer_pricing_defined'. Expected true but observed false. This could be due to insufficient information or conflicting interpretations of pricing details."
      ],
      "evidence_used": [
        "gc_ev_8",
        "gc_ev_22",
        "gc_ev_45",
        "gc_ev_14"
      ],
      "metadata": {
        "object_id": "kernel_output:kin_gc_8_remote_workflow_localmix_calibrated_v1-expected_state",
        "schema_version": "v1",
        "created_at": "2026-03-15T12:15:00Z",
        "updated_at": "2026-03-15T12:15:00Z",
        "source_system": "jigsaw",
        "pipeline_run_id": "remote_workflow_localmix_calibrated_v1-case-01",
        "confidence": 0.6,
        "tags": [
          "kernel-lane",
          "expected-state",
          "lmstudio"
        ],
        "lineage": [
          "kin_gc_8_remote_workflow_localmix_calibrated_v1"
        ]
      }
    },
    {
      "contract": "kernel_output",
      "version": "v1",
      "output_id": "kernel_output:kin_gc_8_remote_workflow_localmix_calibrated_v1-contradiction",
      "kernel_type": "contradiction",
      "input_id": "kin_gc_8_remote_workflow_localmix_calibrated_v1",
      "status": "success",
      "judgment": "contradiction_not_detected",
      "confidence": 0.72,
      "reasons": [
        "No material contradiction detected across the provided input set."
      ],
      "evidence_used": [
        "gc_ev_8",
        "gc_ev_22",
        "gc_ev_45",
        "gc_ev_14"
      ],
      "metadata": {
        "object_id": "kernel_output:kin_gc_8_remote_workflow_localmix_calibrated_v1-contradiction",
        "schema_version": "v1",
        "created_at": "2026-03-15T12:15:00Z",
        "updated_at": "2026-03-15T12:15:00Z",
        "source_system": "jigsaw",
        "pipeline_run_id": "remote_workflow_localmix_calibrated_v1-case-01",
        "confidence": 0.72,
        "tags": [
          "kernel-lane",
          "contradiction"
        ],
        "lineage": [
          "kin_gc_8_remote_workflow_localmix_calibrated_v1"
        ]
      }
    }
  ],
  "composed_summary": {
    "bundle_judgment": "partially_aligned",
    "summary": "The case is only partially aligned and should be treated cautiously."
  },
  "composition_notes": [
    "Alignment remains partial even though the observed picture is usable."
  ],
  "metadata": {
    "object_id": "kernel_bundle:kin_gc_8_remote_workflow_localmix_calibrated_v1",
    "schema_version": "v1",
    "created_at": "2026-03-15T12:15:00Z",
    "updated_at": "2026-03-15T12:15:00Z",
    "source_system": "jigsaw",
    "pipeline_run_id": "remote_workflow_localmix_calibrated_v1-case-01",
    "confidence": 0.6,
    "tags": [
      "kernel-lane",
      "bundle-result"
    ],
    "lineage": [
      "kin_gc_8_remote_workflow_localmix_calibrated_v1",
      "kernel_output:kin_gc_8_remote_workflow_localmix_calibrated_v1-observed_state",
      "kernel_output:kin_gc_8_remote_workflow_localmix_calibrated_v1-expected_state",
      "kernel_output:kin_gc_8_remote_workflow_localmix_calibrated_v1-contradiction"
    ]
  }
}