{
  "contract": "kernel_bundle_result",
  "version": "v1",
  "bundle_id": "kernel_bundle:kin_0001",
  "input_id": "kin_0001",
  "kernel_outputs": [
    {
      "contract": "kernel_output",
      "version": "v1",
      "output_id": "kernel_output:kin_0001-observed_state",
      "kernel_type": "observed_state",
      "input_id": "kin_0001",
      "status": "success",
      "judgment": "observed_state_partial",
      "confidence": 0.7,
      "reasons": [
        "The observed items include three out of four minimum expected observations, with two being positive and one negative regarding the revenue model and customer validation.",
        "There is a conflicting claim about customer validation which adds uncertainty but does not invalidate the existing evidence."
      ],
      "evidence_used": [
        "ev_001",
        "ev_002",
        "ev_003"
      ],
      "metadata": {
        "object_id": "kernel_output:kin_0001-observed_state",
        "schema_version": "v1",
        "created_at": "2026-03-15T09:30:00Z",
        "updated_at": "2026-03-15T09:30:00Z",
        "source_system": "jigsaw",
        "pipeline_run_id": "kernel-lmstudio-mixed-test",
        "confidence": 0.7,
        "tags": [
          "kernel-lane",
          "observed-state",
          "lmstudio"
        ],
        "lineage": [
          "kin_0001"
        ]
      }
    },
    {
      "contract": "kernel_output",
      "version": "v1",
      "output_id": "kernel_output:kin_0001-expected_state",
      "kernel_type": "expected_state",
      "input_id": "kin_0001",
      "status": "success",
      "judgment": "expected_state_partial",
      "confidence": 0.75,
      "reasons": [
        "The revenue model is documented and appears viable, which aligns with the expected state.",
        "Customer validation has not been achieved according to field notes, but there's an internal claim suggesting it is present. This creates a conflict that prevents full alignment."
      ],
      "evidence_used": [
        "ev_001",
        "ev_002",
        "ev_003"
      ],
      "metadata": {
        "object_id": "kernel_output:kin_0001-expected_state",
        "schema_version": "v1",
        "created_at": "2026-03-15T09:30:00Z",
        "updated_at": "2026-03-15T09:30:00Z",
        "source_system": "jigsaw",
        "pipeline_run_id": "kernel-lmstudio-mixed-test",
        "confidence": 0.75,
        "tags": [
          "kernel-lane",
          "expected-state",
          "lmstudio"
        ],
        "lineage": [
          "kin_0001"
        ]
      }
    },
    {
      "contract": "kernel_output",
      "version": "v1",
      "output_id": "kernel_output:kin_0001-contradiction",
      "kernel_type": "contradiction",
      "input_id": "kin_0001",
      "status": "success",
      "judgment": "contradiction_detected",
      "confidence": 0.81,
      "reasons": [
        "customer_validation is observed as False but claimed as True."
      ],
      "evidence_used": [
        "ev_001",
        "ev_002",
        "ev_003"
      ],
      "metadata": {
        "object_id": "kernel_output:kin_0001-contradiction",
        "schema_version": "v1",
        "created_at": "2026-03-15T09:30:00Z",
        "updated_at": "2026-03-15T09:30:00Z",
        "source_system": "jigsaw",
        "pipeline_run_id": "kernel-lmstudio-mixed-test",
        "confidence": 0.81,
        "tags": [
          "kernel-lane",
          "contradiction"
        ],
        "lineage": [
          "kin_0001"
        ]
      }
    }
  ],
  "composed_summary": {
    "bundle_judgment": "contradictory",
    "summary": "The case is partially understood but internally unstable because the inputs conflict."
  },
  "composition_notes": [
    "Contradiction lowers trust even where alignment is otherwise usable."
  ],
  "metadata": {
    "object_id": "kernel_bundle:kin_0001",
    "schema_version": "v1",
    "created_at": "2026-03-15T09:30:00Z",
    "updated_at": "2026-03-15T09:30:00Z",
    "source_system": "jigsaw",
    "pipeline_run_id": "kernel-lmstudio-mixed-test",
    "confidence": 0.7,
    "tags": [
      "kernel-lane",
      "bundle-result"
    ],
    "lineage": [
      "kin_0001",
      "kernel_output:kin_0001-observed_state",
      "kernel_output:kin_0001-expected_state",
      "kernel_output:kin_0001-contradiction"
    ]
  }
}