{
  "contract": "kernel_bundle_result",
  "version": "v1",
  "bundle_id": "kernel_bundle:kin_gc_8_remote_workflow_localmix_v1",
  "input_id": "kin_gc_8_remote_workflow_localmix_v1",
  "kernel_outputs": [
    {
      "contract": "kernel_output",
      "version": "v1",
      "output_id": "kernel_output:kin_gc_8_remote_workflow_localmix_v1-observed_state",
      "kernel_type": "observed_state",
      "input_id": "kin_gc_8_remote_workflow_localmix_v1",
      "status": "success",
      "judgment": "observed_state_clear",
      "confidence": 0.78,
      "reasons": [
        "The observed_count is equal to the minimum_expected_observations (4), and all observation slots are directly evidenced with provided evidence.",
        "Three out of four observed values are favorable, while one is false. This indicates a mix in polarity despite complete coverage.",
        "Observation Coverage: All required observation slots have been filled with direct evidence."
      ],
      "evidence_used": [
        "gc_ev_8",
        "gc_ev_22",
        "gc_ev_45",
        "gc_ev_14"
      ],
      "metadata": {
        "object_id": "kernel_output:kin_gc_8_remote_workflow_localmix_v1-observed_state",
        "schema_version": "v1",
        "created_at": "2026-03-15T12:15:00Z",
        "updated_at": "2026-03-15T12:15:00Z",
        "source_system": "jigsaw",
        "pipeline_run_id": "remote_workflow_localmix_v1-case-01",
        "confidence": 0.78,
        "tags": [
          "kernel-lane",
          "observed-state",
          "lmstudio"
        ],
        "lineage": [
          "kin_gc_8_remote_workflow_localmix_v1"
        ]
      }
    },
    {
      "contract": "kernel_output",
      "version": "v1",
      "output_id": "kernel_output:kin_gc_8_remote_workflow_localmix_v1-expected_state",
      "kernel_type": "expected_state",
      "input_id": "kin_gc_8_remote_workflow_localmix_v1",
      "status": "success",
      "judgment": "expected_state_aligned",
      "confidence": 0.8125,
      "reasons": [
        "The expected_state profile remote_workflow_localmix_v1 requires four slots. The observed picture includes evidence for three of them: workflow_automation_focus, consulting_use_case_defined, and operations_scaffold_present are all aligned with the expected values (true). However, offer_pricing_defined is misaligned because it expects true but the observation does not mention or confirm pricing details.",
        "Misaligned expected slots: offer_pricing_defined."
      ],
      "evidence_used": [
        "gc_ev_8",
        "gc_ev_22",
        "gc_ev_45",
        "gc_ev_14"
      ],
      "metadata": {
        "object_id": "kernel_output:kin_gc_8_remote_workflow_localmix_v1-expected_state",
        "schema_version": "v1",
        "created_at": "2026-03-15T12:15:00Z",
        "updated_at": "2026-03-15T12:15:00Z",
        "source_system": "jigsaw",
        "pipeline_run_id": "remote_workflow_localmix_v1-case-01",
        "confidence": 0.8125,
        "tags": [
          "kernel-lane",
          "expected-state",
          "lmstudio"
        ],
        "lineage": [
          "kin_gc_8_remote_workflow_localmix_v1"
        ]
      }
    },
    {
      "contract": "kernel_output",
      "version": "v1",
      "output_id": "kernel_output:kin_gc_8_remote_workflow_localmix_v1-contradiction",
      "kernel_type": "contradiction",
      "input_id": "kin_gc_8_remote_workflow_localmix_v1",
      "status": "success",
      "judgment": "contradiction_not_detected",
      "confidence": 0.72,
      "reasons": [
        "No material contradiction detected across the provided input set."
      ],
      "evidence_used": [
        "gc_ev_8",
        "gc_ev_22",
        "gc_ev_45",
        "gc_ev_14"
      ],
      "metadata": {
        "object_id": "kernel_output:kin_gc_8_remote_workflow_localmix_v1-contradiction",
        "schema_version": "v1",
        "created_at": "2026-03-15T12:15:00Z",
        "updated_at": "2026-03-15T12:15:00Z",
        "source_system": "jigsaw",
        "pipeline_run_id": "remote_workflow_localmix_v1-case-01",
        "confidence": 0.72,
        "tags": [
          "kernel-lane",
          "contradiction"
        ],
        "lineage": [
          "kin_gc_8_remote_workflow_localmix_v1"
        ]
      }
    }
  ],
  "composed_summary": {
    "bundle_judgment": "aligned",
    "summary": "The case is clear enough and aligns with the expected state."
  },
  "composition_notes": [
    "No contradiction detected across the first kernel bundle."
  ],
  "metadata": {
    "object_id": "kernel_bundle:kin_gc_8_remote_workflow_localmix_v1",
    "schema_version": "v1",
    "created_at": "2026-03-15T12:15:00Z",
    "updated_at": "2026-03-15T12:15:00Z",
    "source_system": "jigsaw",
    "pipeline_run_id": "remote_workflow_localmix_v1-case-01",
    "confidence": 0.72,
    "tags": [
      "kernel-lane",
      "bundle-result"
    ],
    "lineage": [
      "kin_gc_8_remote_workflow_localmix_v1",
      "kernel_output:kin_gc_8_remote_workflow_localmix_v1-observed_state",
      "kernel_output:kin_gc_8_remote_workflow_localmix_v1-expected_state",
      "kernel_output:kin_gc_8_remote_workflow_localmix_v1-contradiction"
    ]
  }
}