{
  "contract": "kernel_bundle_result",
  "version": "v1",
  "bundle_id": "kernel_bundle:kin_gc_14_remote_workflow_localmix_v1",
  "input_id": "kin_gc_14_remote_workflow_localmix_v1",
  "kernel_outputs": [
    {
      "contract": "kernel_output",
      "version": "v1",
      "output_id": "kernel_output:kin_gc_14_remote_workflow_localmix_v1-observed_state",
      "kernel_type": "observed_state",
      "input_id": "kin_gc_14_remote_workflow_localmix_v1",
      "status": "success",
      "judgment": "observed_state_clear",
      "confidence": 0.78,
      "reasons": [
        "The observed_count is equal to the minimum_expected_observations (4), and all observation slots are directly evidenced by the provided evidence.",
        "Three out of four observations have false or weak values, while one has a true value. This indicates mixed polarity with some favorable but mostly unfavorable elements."
      ],
      "evidence_used": [
        "gc_ev_14",
        "gc_ev_8",
        "gc_ev_45",
        "gc_ev_9"
      ],
      "metadata": {
        "object_id": "kernel_output:kin_gc_14_remote_workflow_localmix_v1-observed_state",
        "schema_version": "v1",
        "created_at": "2026-03-15T12:15:00Z",
        "updated_at": "2026-03-15T12:15:00Z",
        "source_system": "jigsaw",
        "pipeline_run_id": "remote_workflow_localmix_v1-case-04",
        "confidence": 0.78,
        "tags": [
          "kernel-lane",
          "observed-state",
          "lmstudio"
        ],
        "lineage": [
          "kin_gc_14_remote_workflow_localmix_v1"
        ]
      }
    },
    {
      "contract": "kernel_output",
      "version": "v1",
      "output_id": "kernel_output:kin_gc_14_remote_workflow_localmix_v1-expected_state",
      "kernel_type": "expected_state",
      "input_id": "kin_gc_14_remote_workflow_localmix_v1",
      "status": "success",
      "judgment": "expected_state_misaligned",
      "confidence": 0.6375,
      "reasons": [
        "The observed state has an operations scaffold, which aligns with the expected value. The other three expected slots are not present in the observed picture.",
        "None of the missing slots have any supporting evidence from the provided observations."
      ],
      "evidence_used": [
        "gc_ev_14",
        "gc_ev_8",
        "gc_ev_45",
        "gc_ev_9"
      ],
      "metadata": {
        "object_id": "kernel_output:kin_gc_14_remote_workflow_localmix_v1-expected_state",
        "schema_version": "v1",
        "created_at": "2026-03-15T12:15:00Z",
        "updated_at": "2026-03-15T12:15:00Z",
        "source_system": "jigsaw",
        "pipeline_run_id": "remote_workflow_localmix_v1-case-04",
        "confidence": 0.6375,
        "tags": [
          "kernel-lane",
          "expected-state",
          "lmstudio"
        ],
        "lineage": [
          "kin_gc_14_remote_workflow_localmix_v1"
        ]
      }
    },
    {
      "contract": "kernel_output",
      "version": "v1",
      "output_id": "kernel_output:kin_gc_14_remote_workflow_localmix_v1-contradiction",
      "kernel_type": "contradiction",
      "input_id": "kin_gc_14_remote_workflow_localmix_v1",
      "status": "success",
      "judgment": "contradiction_not_detected",
      "confidence": 0.72,
      "reasons": [
        "No material contradiction detected across the provided input set."
      ],
      "evidence_used": [
        "gc_ev_14",
        "gc_ev_8",
        "gc_ev_45",
        "gc_ev_9"
      ],
      "metadata": {
        "object_id": "kernel_output:kin_gc_14_remote_workflow_localmix_v1-contradiction",
        "schema_version": "v1",
        "created_at": "2026-03-15T12:15:00Z",
        "updated_at": "2026-03-15T12:15:00Z",
        "source_system": "jigsaw",
        "pipeline_run_id": "remote_workflow_localmix_v1-case-04",
        "confidence": 0.72,
        "tags": [
          "kernel-lane",
          "contradiction"
        ],
        "lineage": [
          "kin_gc_14_remote_workflow_localmix_v1"
        ]
      }
    }
  ],
  "composed_summary": {
    "bundle_judgment": "partially_aligned",
    "summary": "The case is only partially aligned and should be treated cautiously."
  },
  "composition_notes": [
    "Alignment remains partial even though the observed picture is usable."
  ],
  "metadata": {
    "object_id": "kernel_bundle:kin_gc_14_remote_workflow_localmix_v1",
    "schema_version": "v1",
    "created_at": "2026-03-15T12:15:00Z",
    "updated_at": "2026-03-15T12:15:00Z",
    "source_system": "jigsaw",
    "pipeline_run_id": "remote_workflow_localmix_v1-case-04",
    "confidence": 0.6375,
    "tags": [
      "kernel-lane",
      "bundle-result"
    ],
    "lineage": [
      "kin_gc_14_remote_workflow_localmix_v1",
      "kernel_output:kin_gc_14_remote_workflow_localmix_v1-observed_state",
      "kernel_output:kin_gc_14_remote_workflow_localmix_v1-expected_state",
      "kernel_output:kin_gc_14_remote_workflow_localmix_v1-contradiction"
    ]
  }
}